{
  "$schema": "https://json-schema.org/draft/2020-12/schema",
  "$id": "https://github.com/matlab-interface-spec/schemas/observation.schema.json",
  "title": "Black-box observation record",
  "description": "A serialised record of a black-box experiment: independently constructed inputs run against MATLAB used strictly as an oracle, with observed value, class and dimensions. Contains no documentation text (constitution.md §3, §6).",
  "type": "object",
  "additionalProperties": false,
  "required": [
    "schema_version",
    "function_name",
    "release",
    "platform",
    "generated_by",
    "date",
    "cases"
  ],
  "properties": {
    "schema_version": {
      "type": "string",
      "pattern": "^[0-9]+\\.[0-9]+(\\.[0-9]+)?$"
    },
    "function_name": { "type": "string", "minLength": 1 },
    "release": {
      "type": "string",
      "description": "MATLAB release the observations were taken on, e.g. 'R2026a'.",
      "minLength": 1
    },
    "version_string": {
      "type": "string",
      "description": "Optional full version string as reported by the oracle (e.g. output of version)."
    },
    "platform": {
      "type": "string",
      "description": "Platform identifier, e.g. 'GLNXA64', 'MACA64', 'PCWIN64'.",
      "minLength": 1
    },
    "generated_by": {
      "type": "string",
      "description": "Path to the experiment script that produced this record."
    },
    "date": {
      "type": "string",
      "format": "date",
      "pattern": "^[0-9]{4}-[0-9]{2}-[0-9]{2}$"
    },
    "notes": { "type": "string" },
    "cases": {
      "type": "array",
      "minItems": 1,
      "items": { "$ref": "#/$defs/case" }
    }
  },
  "$defs": {
    "case": {
      "type": "object",
      "additionalProperties": false,
      "required": ["case_id", "call", "errored"],
      "description": "One experimental call. Inputs are described independently; do not copy documented examples.",
      "properties": {
        "case_id": {
          "type": "string",
          "pattern": "^[A-Za-z0-9_.-]+$"
        },
        "description": {
          "type": "string",
          "description": "Plain-language description of what this case exercises."
        },
        "call": {
          "type": "string",
          "description": "The exact call expression evaluated, as text (e.g. 'median([1 2 3 4])')."
        },
        "inputs": {
          "type": "object",
          "description": "Optional structured description of the independently constructed inputs (class, size, values).",
          "additionalProperties": true
        },
        "errored": {
          "type": "boolean",
          "description": "True if the call raised an error."
        },
        "error_identifier": {
          "type": "string",
          "description": "MATLAB error identifier, if the call errored (e.g. 'MATLAB:...')."
        },
        "error_message_summary": {
          "type": "string",
          "description": "Short, factual paraphrase of the error condition. Do not paste full proprietary message text verbatim beyond what is needed to identify the error."
        },
        "result": {
          "$ref": "#/$defs/result",
          "description": "Present when errored = false."
        },
        "tolerance": {
          "type": ["number", "string"],
          "description": "Numerical tolerance relevant to comparing this result, if any (absolute value or expression)."
        }
      },
      "allOf": [
        {
          "if": { "properties": { "errored": { "const": false } } },
          "then": { "required": ["result"] }
        },
        {
          "if": { "properties": { "errored": { "const": true } } },
          "then": { "required": ["error_identifier"] }
        }
      ]
    },
    "result": {
      "type": "object",
      "additionalProperties": false,
      "description": "Observed output described by value, class and dimensions.",
      "required": ["class", "size"],
      "properties": {
        "value": {
          "description": "The serialised output value (number, array, string, or nested arrays). NaN/Inf serialised as strings 'NaN'/'Inf'/'-Inf' where JSON cannot represent them.",
          "type": ["number", "string", "boolean", "array", "object", "null"]
        },
        "class": {
          "type": "string",
          "description": "MATLAB class of the output, e.g. 'double', 'single', 'int32'."
        },
        "size": {
          "type": "array",
          "description": "Size vector of the output, e.g. [1, 1] for a scalar.",
          "items": { "type": "integer", "minimum": 0 },
          "minItems": 1
        },
        "isreal": {
          "type": "boolean",
          "description": "Whether the output is real (as reported by isreal)."
        },
        "issparse": {
          "type": "boolean",
          "description": "Whether the output is sparse (as reported by issparse)."
        }
      }
    }
  }
}
