{
  "schema_version": "1.0",
  "function_name": "strmatch",
  "release": "R2026a",
  "version_string": "26.1.0.3276743 (R2026a) Update 3",
  "platform": "GLNXA64",
  "generated_by": "experiments/strmatch/test_strmatch_interface.m",
  "date": "2026-07-21",
  "notes": "SKELETON run: values recorded via describe_value (mat2str for numeric/char/logical, else a class/size tag). Multi-output forms record only the first output.",
  "cases": [
    {
      "case_id": "prefix",
      "description": "prefix match in a cellstr",
      "call": "strmatch('ap', {'apple';'apricot';'banana'})",
      "errored": false,
      "result": {
        "value": "[1;2]",
        "class": "double",
        "size": [
          2,
          1
        ],
        "isreal": true,
        "issparse": false
      }
    },
    {
      "case_id": "exact",
      "description": "exact match",
      "call": "strmatch('apple', {'apple';'apple pie'}, 'exact')",
      "errored": false,
      "result": {
        "value": "1",
        "class": "double",
        "size": [
          1,
          1
        ],
        "isreal": true,
        "issparse": false
      }
    },
    {
      "case_id": "no-match",
      "description": "no match",
      "call": "strmatch('zz', {'apple';'banana'})",
      "errored": false,
      "result": {
        "value": "zeros(0,1)",
        "class": "double",
        "size": [
          0,
          1
        ],
        "isreal": true,
        "issparse": false
      }
    }
  ]
}