{
  "schema_version": "1.0",
  "function_name": "issparse",
  "release": "R2026a",
  "version_string": "26.1.0.3276743 (R2026a) Update 3",
  "platform": "GLNXA64",
  "generated_by": "experiments/issparse/test_issparse_interface.m",
  "date": "2026-07-22",
  "notes": "SKELETON run: values via describe_value; multi-output forms record only the first output.",
  "cases": [
    {
      "case_id": "sparse",
      "description": "sparse matrix",
      "call": "issparse(sparse([1 0; 0 2]))",
      "errored": false,
      "result": {
        "value": "true",
        "class": "logical",
        "size": [
          1,
          1
        ],
        "isreal": true,
        "issparse": false
      }
    },
    {
      "case_id": "full",
      "description": "full matrix",
      "call": "issparse([1 2; 3 4])",
      "errored": false,
      "result": {
        "value": "false",
        "class": "logical",
        "size": [
          1,
          1
        ],
        "isreal": true,
        "issparse": false
      }
    },
    {
      "case_id": "empty-sparse",
      "description": "empty sparse array",
      "call": "issparse(sparse([]))",
      "errored": false,
      "result": {
        "value": "true",
        "class": "logical",
        "size": [
          1,
          1
        ],
        "isreal": true,
        "issparse": false
      }
    }
  ]
}