{
  "schema_version": "1.0",
  "function_name": "iscolumn",
  "release": "R2026a",
  "version_string": "26.1.0.3276743 (R2026a) Update 3",
  "platform": "GLNXA64",
  "generated_by": "experiments/iscolumn/test_iscolumn_interface.m",
  "date": "2026-07-22",
  "notes": "SKELETON run: values via describe_value; multi-output forms record only the first output.",
  "cases": [
    {
      "case_id": "column",
      "description": "column vector",
      "call": "iscolumn([1; 2; 3])",
      "errored": false,
      "result": {
        "value": "true",
        "class": "logical",
        "size": [
          1,
          1
        ],
        "isreal": true,
        "issparse": false
      }
    },
    {
      "case_id": "row",
      "description": "row vector",
      "call": "iscolumn([1 2 3])",
      "errored": false,
      "result": {
        "value": "false",
        "class": "logical",
        "size": [
          1,
          1
        ],
        "isreal": true,
        "issparse": false
      }
    },
    {
      "case_id": "scalar",
      "description": "scalar",
      "call": "iscolumn(5)",
      "errored": false,
      "result": {
        "value": "true",
        "class": "logical",
        "size": [
          1,
          1
        ],
        "isreal": true,
        "issparse": false
      }
    },
    {
      "case_id": "matrix",
      "description": "2-D matrix",
      "call": "iscolumn([1 2; 3 4])",
      "errored": false,
      "result": {
        "value": "false",
        "class": "logical",
        "size": [
          1,
          1
        ],
        "isreal": true,
        "issparse": false
      }
    }
  ]
}