{
  "schema_version": "1.0",
  "function_name": "table2array",
  "release": "R2026a",
  "version_string": "26.1.0.3276743 (R2026a) Update 3",
  "platform": "GLNXA64",
  "generated_by": "experiments/table2array/test_table2array_interface.m",
  "date": "2026-07-21",
  "notes": "SKELETON run: values recorded via describe_value (mat2str for numeric/char/logical, else a class/size tag). Multi-output forms record only the first output.",
  "cases": [
    {
      "case_id": "numeric",
      "description": "numeric table",
      "call": "table2array(array2table([1 2; 3 4]))",
      "errored": false,
      "result": {
        "value": "[1 2;3 4]",
        "class": "double",
        "size": [
          2,
          2
        ],
        "isreal": true,
        "issparse": false
      }
    }
  ]
}