{
  "schema_version": "1.0",
  "function_name": "full",
  "release": "R2026a",
  "version_string": "26.1.0.3276743 (R2026a) Update 3",
  "platform": "GLNXA64",
  "generated_by": "experiments/full/test_full_interface.m",
  "date": "2026-07-21",
  "notes": "SKELETON run: values recorded via describe_value (mat2str for numeric/char/logical, else a class/size tag). Multi-output forms record only the first output.",
  "cases": [
    {
      "case_id": "from-sparse-matrix",
      "description": "full of a sparse matrix",
      "call": "full(sparse([1 0; 0 2]))",
      "errored": false,
      "result": {
        "value": "[1 0;0 2]",
        "class": "double",
        "size": [
          2,
          2
        ],
        "isreal": true,
        "issparse": false
      }
    },
    {
      "case_id": "from-sparse-vector",
      "description": "full of a sparse vector",
      "call": "full(sparse([0 3 0]))",
      "errored": false,
      "result": {
        "value": "[0 3 0]",
        "class": "double",
        "size": [
          1,
          3
        ],
        "isreal": true,
        "issparse": false
      }
    },
    {
      "case_id": "already-full",
      "description": "full of an already-full matrix",
      "call": "full([1 2; 3 4])",
      "errored": false,
      "result": {
        "value": "[1 2;3 4]",
        "class": "double",
        "size": [
          2,
          2
        ],
        "isreal": true,
        "issparse": false
      }
    },
    {
      "case_id": "empty-sparse",
      "description": "full of an empty sparse array",
      "call": "full(sparse([]))",
      "errored": false,
      "result": {
        "value": "[]",
        "class": "double",
        "size": [
          0,
          0
        ],
        "isreal": true,
        "issparse": false
      }
    }
  ]
}